{
 "name": "Base (Sepolia)",
 "kind": "evm",
 "oracle": "0x50840a7667baEa9D05ad4ae3dCeb384724b58720",
 "rpc": "https://sepolia.base.org",
 "block": 47966099,
 "maxStaleness": 777600,
 "readAt": 1791700520,
 "targets": [
  {
   "index": 0,
   "target": "0xbbbbbbbbbb9cc5e90e3b3af64bdaf62c37eeffcb",
   "adminKeyScore": 65,
   "multisigScore": 95,
   "timelockScore": 0,
   "oracleAuthorityScore": 100,
   "crossExposureScore": 80,
   "compositeScore": 55,
   "lastUpdated": 1791653885,
   "methodologyHash": "0x4fad7e994ac7045d9e23e7bda2f85c5c3f210b8ac57da920ea123896f807df9d",
   "stale": false,
   "previousComposite": 55,
   "previousRun": "2026-10-11T00:39:01Z"
  },
  {
   "index": 1,
   "target": "0xe20fcbdbffc4dd138ce8b2e6fbb6cb49777ad64d",
   "adminKeyScore": 65,
   "multisigScore": 100,
   "timelockScore": 50,
   "oracleAuthorityScore": 52,
   "crossExposureScore": 80,
   "compositeScore": 71,
   "lastUpdated": 1791653885,
   "methodologyHash": "0x4fad7e994ac7045d9e23e7bda2f85c5c3f210b8ac57da920ea123896f807df9d",
   "stale": false,
   "previousComposite": 71,
   "previousRun": "2026-10-11T00:39:01Z"
  },
  {
   "index": 2,
   "target": "0x420dd381b31aef6683db6b902084cb0ffece40da",
   "adminKeyScore": 65,
   "multisigScore": 65,
   "timelockScore": 0,
   "oracleAuthorityScore": 100,
   "crossExposureScore": 80,
   "compositeScore": 46,
   "lastUpdated": 1791653885,
   "methodologyHash": "0x4fad7e994ac7045d9e23e7bda2f85c5c3f210b8ac57da920ea123896f807df9d",
   "stale": false,
   "previousComposite": 46,
   "previousRun": "2026-10-11T00:39:01Z"
  },
  {
   "index": 3,
   "target": "0x33128a8fc17869897dce68ed026d694621f6fdfd",
   "adminKeyScore": 80,
   "multisigScore": 100,
   "timelockScore": 75,
   "oracleAuthorityScore": 100,
   "crossExposureScore": 80,
   "compositeScore": 85,
   "lastUpdated": 1791653885,
   "methodologyHash": "0x4fad7e994ac7045d9e23e7bda2f85c5c3f210b8ac57da920ea123896f807df9d",
   "stale": false,
   "previousComposite": 85,
   "previousRun": "2026-10-11T00:39:01Z"
  },
  {
   "index": 4,
   "target": "0xb125e6687d4313864e53df431d5425969c15eb2f",
   "adminKeyScore": 75,
   "multisigScore": 100,
   "timelockScore": 60,
   "oracleAuthorityScore": 52,
   "crossExposureScore": 80,
   "compositeScore": 78,
   "lastUpdated": 1791653885,
   "methodologyHash": "0x4fad7e994ac7045d9e23e7bda2f85c5c3f210b8ac57da920ea123896f807df9d",
   "stale": false,
   "previousComposite": 78,
   "previousRun": "2026-10-11T00:39:01Z"
  },
  {
   "index": 5,
   "target": "0x5e7bb104d84c7cb9b682aac2f3d509f5f406809a",
   "adminKeyScore": 65,
   "multisigScore": 65,
   "timelockScore": 0,
   "oracleAuthorityScore": 100,
   "crossExposureScore": 80,
   "compositeScore": 46,
   "lastUpdated": 1791653885,
   "methodologyHash": "0x4fad7e994ac7045d9e23e7bda2f85c5c3f210b8ac57da920ea123896f807df9d",
   "stale": false,
   "previousComposite": 46,
   "previousRun": "2026-10-11T00:39:01Z"
  },
  {
   "index": 6,
   "target": "0x8909dc15e40173ff4699343b6eb8132c65e18ec6",
   "adminKeyScore": 80,
   "multisigScore": 100,
   "timelockScore": 75,
   "oracleAuthorityScore": 100,
   "crossExposureScore": 80,
   "compositeScore": 85,
   "lastUpdated": 1791653885,
   "methodologyHash": "0x4fad7e994ac7045d9e23e7bda2f85c5c3f210b8ac57da920ea123896f807df9d",
   "stale": false,
   "previousComposite": 85,
   "previousRun": "2026-10-11T00:39:01Z"
  },
  {
   "index": 7,
   "target": "0x498581ff718922c3f8e6a244956af099b2652b2b",
   "adminKeyScore": 80,
   "multisigScore": 100,
   "timelockScore": 75,
   "oracleAuthorityScore": 100,
   "crossExposureScore": 80,
   "compositeScore": 85,
   "lastUpdated": 1791653885,
   "methodologyHash": "0x4fad7e994ac7045d9e23e7bda2f85c5c3f210b8ac57da920ea123896f807df9d",
   "stale": false,
   "previousComposite": 85,
   "previousRun": "2026-10-11T00:39:01Z"
  },
  {
   "index": 8,
   "target": "0xfbb21d0380bee3312b33c4353c8936a0f13ef26c",
   "adminKeyScore": 65,
   "multisigScore": 100,
   "timelockScore": 50,
   "oracleAuthorityScore": 52,
   "crossExposureScore": 100,
   "compositeScore": 71,
   "lastUpdated": 1791653885,
   "methodologyHash": "0x4fad7e994ac7045d9e23e7bda2f85c5c3f210b8ac57da920ea123896f807df9d",
   "stale": false,
   "previousComposite": 71,
   "previousRun": "2026-10-11T00:39:01Z"
  },
  {
   "index": 9,
   "target": "0xee8f4ec5672f09119b96ab6fb59c27e1b7e44b61",
   "adminKeyScore": 60,
   "multisigScore": 65,
   "timelockScore": 75,
   "oracleAuthorityScore": 52,
   "crossExposureScore": 100,
   "compositeScore": 66,
   "lastUpdated": 1791653885,
   "methodologyHash": "0x4fad7e994ac7045d9e23e7bda2f85c5c3f210b8ac57da920ea123896f807df9d",
   "stale": false,
   "previousComposite": 66,
   "previousRun": "2026-10-11T00:39:01Z"
  },
  {
   "index": 10,
   "target": "0x7bfa7c4f149e7415b73bdedfe609237e29cbf34a",
   "adminKeyScore": 60,
   "multisigScore": 55,
   "timelockScore": 75,
   "oracleAuthorityScore": 52,
   "crossExposureScore": 100,
   "compositeScore": 63,
   "lastUpdated": 1791653885,
   "methodologyHash": "0x4fad7e994ac7045d9e23e7bda2f85c5c3f210b8ac57da920ea123896f807df9d",
   "stale": false,
   "previousComposite": 63,
   "previousRun": "2026-10-11T00:39:01Z"
  },
  {
   "index": 11,
   "target": "0xbeef010f9cb27031ad51e3333f9af9c6b1228183",
   "adminKeyScore": 70,
   "multisigScore": 75,
   "timelockScore": 75,
   "oracleAuthorityScore": 52,
   "crossExposureScore": 60,
   "compositeScore": 73,
   "lastUpdated": 1791653885,
   "methodologyHash": "0x4fad7e994ac7045d9e23e7bda2f85c5c3f210b8ac57da920ea123896f807df9d",
   "stale": false,
   "previousComposite": 73,
   "previousRun": "2026-10-11T00:39:01Z"
  },
  {
   "index": 12,
   "target": "0xbeef2d50b428675a1921bc6bbf4bfb9d8cf1461a",
   "adminKeyScore": 70,
   "multisigScore": 75,
   "timelockScore": 75,
   "oracleAuthorityScore": 52,
   "crossExposureScore": 60,
   "compositeScore": 73,
   "lastUpdated": 1791653885,
   "methodologyHash": "0x4fad7e994ac7045d9e23e7bda2f85c5c3f210b8ac57da920ea123896f807df9d",
   "stale": false,
   "previousComposite": 73,
   "previousRun": "2026-10-11T00:39:01Z"
  }
 ],
 "self": {
  "code_hash": "714f7e2a4131dc657f0b333392998aa45a874dc82f3e86c6b07c28514736e4e4",
  "role_events": [],
  "from_block": 47955430,
  "to_block": 47966099,
  "read": true,
  "roles": {
   "0x20630C6Ab4BA48a80edA46F77b9b6e987A8f32f5": {
    "admin": true,
    "updater": true
   },
   "0x646968c33D8F6d5A343B68a6F8b1Ce52F13414ba": {
    "admin": false,
    "updater": false
   }
  },
  "log_span": 200
 },
 "self_scanned_to": 47966099
}