{
 "name": "Arbitrum (Sepolia)",
 "kind": "evm",
 "oracle": "0x50840a7667baEa9D05ad4ae3dCeb384724b58720",
 "rpc": "https://sepolia-rollup.arbitrum.io/rpc",
 "block": 318418840,
 "maxStaleness": 777600,
 "readAt": 1791809524,
 "targets": [
  {
   "index": 0,
   "target": "0x3c3d99fd298f679dbc2cecd132b4ec4d0f5e6e72",
   "adminKeyScore": 10,
   "multisigScore": 0,
   "timelockScore": 50,
   "oracleAuthorityScore": 52,
   "crossExposureScore": 80,
   "compositeScore": 19,
   "lastUpdated": 1791658650,
   "methodologyHash": "0xf178bca63c9d3257a306dd7cf6a4e5b3e3817a4ae59fd289ae3486d7bbc25374",
   "stale": false,
   "previousComposite": 19,
   "previousRun": "2026-10-12T10:01:51Z"
  },
  {
   "index": 1,
   "target": "0x1a3c9b1d2f0529d97f2afc5136cc23e58f1fd35b",
   "adminKeyScore": 50,
   "multisigScore": 35,
   "timelockScore": 0,
   "oracleAuthorityScore": 100,
   "crossExposureScore": 100,
   "compositeScore": 31,
   "lastUpdated": 1791658650,
   "methodologyHash": "0xf178bca63c9d3257a306dd7cf6a4e5b3e3817a4ae59fd289ae3486d7bbc25374",
   "stale": false,
   "previousComposite": 31,
   "previousRun": "2026-10-12T10:01:51Z"
  },
  {
   "index": 2,
   "target": "0xe23b4ae3624fb6f7cdef29bc8ead912f1ede6886",
   "adminKeyScore": 65,
   "multisigScore": 95,
   "timelockScore": 0,
   "oracleAuthorityScore": 52,
   "crossExposureScore": 100,
   "compositeScore": 55,
   "lastUpdated": 1791658650,
   "methodologyHash": "0xf178bca63c9d3257a306dd7cf6a4e5b3e3817a4ae59fd289ae3486d7bbc25374",
   "stale": false,
   "previousComposite": 55,
   "previousRun": "2026-10-12T10:01:51Z"
  },
  {
   "index": 3,
   "target": "0x423552c0f05baccac5bfa91c6dcf1dc53a0a1641",
   "adminKeyScore": 55,
   "multisigScore": 100,
   "timelockScore": 40,
   "oracleAuthorityScore": 100,
   "crossExposureScore": 100,
   "compositeScore": 64,
   "lastUpdated": 1791658650,
   "methodologyHash": "0xf178bca63c9d3257a306dd7cf6a4e5b3e3817a4ae59fd289ae3486d7bbc25374",
   "stale": false,
   "previousComposite": 64,
   "previousRun": "2026-10-12T10:01:51Z"
  },
  {
   "index": 4,
   "target": "0xa97684ead0e402dc232d5a977953df7ecbab3cdb",
   "adminKeyScore": 65,
   "multisigScore": 100,
   "timelockScore": 50,
   "oracleAuthorityScore": 52,
   "crossExposureScore": 80,
   "compositeScore": 71,
   "lastUpdated": 1791658650,
   "methodologyHash": "0xf178bca63c9d3257a306dd7cf6a4e5b3e3817a4ae59fd289ae3486d7bbc25374",
   "stale": false,
   "previousComposite": 71,
   "previousRun": "2026-10-12T10:01:51Z"
  },
  {
   "index": 5,
   "target": "0x9c4ec768c28520b50860ea7a15bd7213a9ff58bf",
   "adminKeyScore": 75,
   "multisigScore": 100,
   "timelockScore": 60,
   "oracleAuthorityScore": 52,
   "crossExposureScore": 80,
   "compositeScore": 78,
   "lastUpdated": 1791658650,
   "methodologyHash": "0xf178bca63c9d3257a306dd7cf6a4e5b3e3817a4ae59fd289ae3486d7bbc25374",
   "stale": false,
   "previousComposite": 78,
   "previousRun": "2026-10-12T10:01:51Z"
  },
  {
   "index": 6,
   "target": "0x888888888889758f76e7103c6cbf23abbf58f946",
   "adminKeyScore": 65,
   "multisigScore": 55,
   "timelockScore": 0,
   "oracleAuthorityScore": 100,
   "crossExposureScore": 80,
   "compositeScore": 43,
   "lastUpdated": 1791658650,
   "methodologyHash": "0xf178bca63c9d3257a306dd7cf6a4e5b3e3817a4ae59fd289ae3486d7bbc25374",
   "stale": false,
   "previousComposite": 43,
   "previousRun": "2026-10-12T10:01:51Z"
  },
  {
   "index": 7,
   "target": "0x52aa899454998be5b000ad077a46bbe360f4e497",
   "adminKeyScore": 65,
   "multisigScore": 55,
   "timelockScore": 55,
   "oracleAuthorityScore": 20,
   "crossExposureScore": 80,
   "compositeScore": 59,
   "lastUpdated": 1791658650,
   "methodologyHash": "0xf178bca63c9d3257a306dd7cf6a4e5b3e3817a4ae59fd289ae3486d7bbc25374",
   "stale": false,
   "previousComposite": 59,
   "previousRun": "2026-10-12T10:01:51Z"
  },
  {
   "index": 8,
   "target": "0x1f98431c8ad98523631ae4a59f267346ea31f984",
   "adminKeyScore": 80,
   "multisigScore": 100,
   "timelockScore": 75,
   "oracleAuthorityScore": 100,
   "crossExposureScore": 80,
   "compositeScore": 85,
   "lastUpdated": 1791658650,
   "methodologyHash": "0xf178bca63c9d3257a306dd7cf6a4e5b3e3817a4ae59fd289ae3486d7bbc25374",
   "stale": false,
   "previousComposite": 85,
   "previousRun": "2026-10-12T10:01:51Z"
  },
  {
   "index": 9,
   "target": "0x489ee077994b6658eafa855c308275ead8097c4a",
   "adminKeyScore": 55,
   "multisigScore": 70,
   "timelockScore": 45,
   "oracleAuthorityScore": 2,
   "crossExposureScore": 80,
   "compositeScore": 57,
   "lastUpdated": 1791658650,
   "methodologyHash": "0xf178bca63c9d3257a306dd7cf6a4e5b3e3817a4ae59fd289ae3486d7bbc25374",
   "stale": false,
   "previousComposite": 57,
   "previousRun": "2026-10-12T10:01:51Z"
  },
  {
   "index": 10,
   "target": "0x6bd780e7fdf01d77e4d475c821f1e7ae05409072",
   "adminKeyScore": 50,
   "multisigScore": 35,
   "timelockScore": 30,
   "oracleAuthorityScore": 20,
   "crossExposureScore": 100,
   "compositeScore": 40,
   "lastUpdated": 1791658650,
   "methodologyHash": "0xf178bca63c9d3257a306dd7cf6a4e5b3e3817a4ae59fd289ae3486d7bbc25374",
   "stale": false,
   "previousComposite": 40,
   "previousRun": "2026-10-12T10:01:51Z"
  },
  {
   "index": 11,
   "target": "0xffa10065ce1d1c42fabc46e06b84ed8ffeb4bae5",
   "adminKeyScore": 20,
   "multisigScore": 0,
   "timelockScore": 0,
   "oracleAuthorityScore": 100,
   "crossExposureScore": 100,
   "compositeScore": 8,
   "lastUpdated": 1791658650,
   "methodologyHash": "0xf178bca63c9d3257a306dd7cf6a4e5b3e3817a4ae59fd289ae3486d7bbc25374",
   "stale": false,
   "previousComposite": 8,
   "previousRun": "2026-10-12T10:01:51Z"
  },
  {
   "index": 12,
   "target": "0xff162c694eaa571f685030649814282ea457f169",
   "adminKeyScore": 10,
   "multisigScore": 0,
   "timelockScore": 0,
   "oracleAuthorityScore": 100,
   "crossExposureScore": 100,
   "compositeScore": 4,
   "lastUpdated": 1791658650,
   "methodologyHash": "0xf178bca63c9d3257a306dd7cf6a4e5b3e3817a4ae59fd289ae3486d7bbc25374",
   "stale": false,
   "previousComposite": 4,
   "previousRun": "2026-10-12T10:01:51Z"
  }
 ],
 "self": {
  "code_hash": "714f7e2a4131dc657f0b333392998aa45a874dc82f3e86c6b07c28514736e4e4",
  "role_events": [],
  "from_block": 318378673,
  "to_block": 318418840,
  "read": true,
  "roles": {
   "0x20630C6Ab4BA48a80edA46F77b9b6e987A8f32f5": {
    "admin": true,
    "updater": true
   },
   "0x646968c33D8F6d5A343B68a6F8b1Ce52F13414ba": {
    "admin": false,
    "updater": false
   }
  },
  "log_span": 5000
 },
 "self_scanned_to": 318418840
}