{
 "name": "Plasma",
 "kind": "evm",
 "oracle": "0x50840a7667baEa9D05ad4ae3dCeb384724b58720",
 "rpc": "https://testnet-rpc.plasma.to",
 "block": 36974266,
 "maxStaleness": 777600,
 "readAt": 1792803545,
 "targets": [
  {
   "index": 0,
   "target": "0x6c50b8ca8eeaa1c75dee5b5ea79772acabc92f48",
   "adminKeyScore": 50,
   "multisigScore": 50,
   "timelockScore": 0,
   "oracleAuthorityScore": 100,
   "crossExposureScore": 100,
   "compositeScore": 35,
   "lastUpdated": 1792447298,
   "methodologyHash": "0xc1d1ba0a9ddfabd18ba1ec3ed1f66dce9babca05f05eaa76acd37cc1d671034c",
   "stale": false,
   "previousComposite": 35,
   "previousRun": "2026-10-23T18:48:46Z"
  },
  {
   "index": 1,
   "target": "0x061d8e131f26512348ee5fa42e2df1ba9d6505e9",
   "adminKeyScore": 65,
   "multisigScore": 100,
   "timelockScore": 50,
   "oracleAuthorityScore": 52,
   "crossExposureScore": 80,
   "compositeScore": 71,
   "lastUpdated": 1792447298,
   "methodologyHash": "0xc1d1ba0a9ddfabd18ba1ec3ed1f66dce9babca05f05eaa76acd37cc1d671034c",
   "stale": false,
   "previousComposite": 71,
   "previousRun": "2026-10-23T18:48:46Z"
  },
  {
   "index": 2,
   "target": "0x888888888889758f76e7103c6cbf23abbf58f946",
   "adminKeyScore": 65,
   "multisigScore": 55,
   "timelockScore": 0,
   "oracleAuthorityScore": 100,
   "crossExposureScore": 80,
   "compositeScore": 43,
   "lastUpdated": 1792447298,
   "methodologyHash": "0xc1d1ba0a9ddfabd18ba1ec3ed1f66dce9babca05f05eaa76acd37cc1d671034c",
   "stale": false,
   "previousComposite": 43,
   "previousRun": "2026-10-23T18:48:46Z"
  },
  {
   "index": 3,
   "target": "0x5d3a1ff2b6bab83b63cd9ad0787074081a52ef34",
   "adminKeyScore": 55,
   "multisigScore": 100,
   "timelockScore": 15,
   "oracleAuthorityScore": 100,
   "crossExposureScore": 80,
   "compositeScore": 57,
   "lastUpdated": 1792447298,
   "methodologyHash": "0xc1d1ba0a9ddfabd18ba1ec3ed1f66dce9babca05f05eaa76acd37cc1d671034c",
   "stale": false,
   "previousComposite": 57,
   "previousRun": "2026-10-23T18:48:46Z"
  },
  {
   "index": 4,
   "target": "0x42388213c6f56d7e1477632b58ae6bba9adeeea3",
   "adminKeyScore": 70,
   "multisigScore": 80,
   "timelockScore": 68,
   "oracleAuthorityScore": 2,
   "crossExposureScore": 80,
   "compositeScore": 72,
   "lastUpdated": 1792447298,
   "methodologyHash": "0xc1d1ba0a9ddfabd18ba1ec3ed1f66dce9babca05f05eaa76acd37cc1d671034c",
   "stale": false,
   "previousComposite": 72,
   "previousRun": "2026-10-23T18:48:46Z"
  },
  {
   "index": 5,
   "target": "0x9b3ceb22cab2f1b9ace4cd3132c8a123552eda2c",
   "adminKeyScore": 68,
   "multisigScore": 80,
   "timelockScore": 55,
   "oracleAuthorityScore": 100,
   "crossExposureScore": 80,
   "compositeScore": 68,
   "lastUpdated": 1792447298,
   "methodologyHash": "0xc1d1ba0a9ddfabd18ba1ec3ed1f66dce9babca05f05eaa76acd37cc1d671034c",
   "stale": false,
   "previousComposite": 68,
   "previousRun": "2026-10-23T18:48:46Z"
  },
  {
   "index": 6,
   "target": "0x52aa899454998be5b000ad077a46bbe360f4e497",
   "adminKeyScore": 65,
   "multisigScore": 55,
   "timelockScore": 55,
   "oracleAuthorityScore": 52,
   "crossExposureScore": 80,
   "compositeScore": 59,
   "lastUpdated": 1792447298,
   "methodologyHash": "0xc1d1ba0a9ddfabd18ba1ec3ed1f66dce9babca05f05eaa76acd37cc1d671034c",
   "stale": false,
   "previousComposite": 59,
   "previousRun": "2026-10-23T18:48:46Z"
  },
  {
   "index": 7,
   "target": "0xa9c251f8304b1b3fc2b9e8fcae78d94eff82ac66",
   "adminKeyScore": 40,
   "multisigScore": 45,
   "timelockScore": 0,
   "oracleAuthorityScore": 34,
   "crossExposureScore": 100,
   "compositeScore": 30,
   "lastUpdated": 1792447298,
   "methodologyHash": "0xc1d1ba0a9ddfabd18ba1ec3ed1f66dce9babca05f05eaa76acd37cc1d671034c",
   "stale": false,
   "previousComposite": 30,
   "previousRun": "2026-10-23T18:48:46Z"
  },
  {
   "index": 8,
   "target": "0x6695c0f8706c5ace3bdf8995073179cca47926dc",
   "adminKeyScore": 65,
   "multisigScore": 55,
   "timelockScore": 0,
   "oracleAuthorityScore": 100,
   "crossExposureScore": 100,
   "compositeScore": 43,
   "lastUpdated": 1792447298,
   "methodologyHash": "0xc1d1ba0a9ddfabd18ba1ec3ed1f66dce9babca05f05eaa76acd37cc1d671034c",
   "stale": false,
   "previousComposite": 43,
   "previousRun": "2026-10-23T18:48:46Z"
  }
 ],
 "self": {
  "code_hash": "f33b2e74ee50352539db6b0cc362185c66f79b6b3930811842912995b1b53def",
  "role_events": [],
  "from_block": 36952085,
  "to_block": 36974266,
  "read": true,
  "roles": {
   "0x20630C6Ab4BA48a80edA46F77b9b6e987A8f32f5": {
    "admin": true,
    "updater": true
   },
   "0x646968c33D8F6d5A343B68a6F8b1Ce52F13414ba": {
    "admin": false,
    "updater": false
   }
  },
  "log_span": 5000
 },
 "self_scanned_to": 36974266
}