{
 "name": "Tempo (Moderato)",
 "kind": "evm",
 "oracle": "0x50840a7667baEa9D05ad4ae3dCeb384724b58720",
 "rpc": "https://rpc.moderato.tempo.xyz",
 "block": 39520148,
 "maxStaleness": 777600,
 "readAt": 1791960820,
 "targets": [
  {
   "index": 0,
   "target": "0xcccccccc00000000000000000000000000000001",
   "adminKeyScore": 50,
   "multisigScore": 37,
   "timelockScore": 0,
   "oracleAuthorityScore": 100,
   "crossExposureScore": 100,
   "compositeScore": 31,
   "lastUpdated": 1791856659,
   "methodologyHash": "0x0a3df5ccf0492a8006278d8f559a8ee72202d8b3d3b01ff5561fa9729045c276",
   "stale": false,
   "previousComposite": 31,
   "previousRun": "2026-10-14T00:53:13Z"
  },
  {
   "index": 1,
   "target": "0x20c000000000000000000000b9537d11c60e8b50",
   "adminKeyScore": 65,
   "multisigScore": 98,
   "timelockScore": 0,
   "oracleAuthorityScore": 100,
   "crossExposureScore": 80,
   "compositeScore": 55,
   "lastUpdated": 1791856659,
   "methodologyHash": "0x0a3df5ccf0492a8006278d8f559a8ee72202d8b3d3b01ff5561fa9729045c276",
   "stale": false,
   "previousComposite": 55,
   "previousRun": "2026-10-14T00:53:13Z"
  },
  {
   "index": 2,
   "target": "0x20c00000000000000000000014f22ca97301eb73",
   "adminKeyScore": 65,
   "multisigScore": 58,
   "timelockScore": 0,
   "oracleAuthorityScore": 100,
   "crossExposureScore": 100,
   "compositeScore": 43,
   "lastUpdated": 1791856659,
   "methodologyHash": "0x0a3df5ccf0492a8006278d8f559a8ee72202d8b3d3b01ff5561fa9729045c276",
   "stale": false,
   "previousComposite": 43,
   "previousRun": "2026-10-14T00:53:13Z"
  },
  {
   "index": 3,
   "target": "0x20c0000000000000000000000000000000000000",
   "adminKeyScore": 10,
   "multisigScore": 15,
   "timelockScore": 0,
   "oracleAuthorityScore": 100,
   "crossExposureScore": 60,
   "compositeScore": 9,
   "lastUpdated": 1791856659,
   "methodologyHash": "0x0a3df5ccf0492a8006278d8f559a8ee72202d8b3d3b01ff5561fa9729045c276",
   "stale": false,
   "previousComposite": 9,
   "previousRun": "2026-10-14T00:53:13Z"
  },
  {
   "index": 4,
   "target": "0x20c0000000000000000000003158081efd85bfc2",
   "adminKeyScore": 10,
   "multisigScore": 15,
   "timelockScore": 0,
   "oracleAuthorityScore": 100,
   "crossExposureScore": 60,
   "compositeScore": 9,
   "lastUpdated": 1791856659,
   "methodologyHash": "0x0a3df5ccf0492a8006278d8f559a8ee72202d8b3d3b01ff5561fa9729045c276",
   "stale": false,
   "previousComposite": 9,
   "previousRun": "2026-10-14T00:53:13Z"
  },
  {
   "index": 5,
   "target": "0x20c000000000000000000000c412ec89d0c08be5",
   "adminKeyScore": 65,
   "multisigScore": 42,
   "timelockScore": 0,
   "oracleAuthorityScore": 100,
   "crossExposureScore": 80,
   "compositeScore": 39,
   "lastUpdated": 1791856659,
   "methodologyHash": "0x0a3df5ccf0492a8006278d8f559a8ee72202d8b3d3b01ff5561fa9729045c276",
   "stale": false,
   "previousComposite": 39,
   "previousRun": "2026-10-14T00:53:13Z"
  },
  {
   "index": 6,
   "target": "0x20c00000000000000000000058d0b8b2cfdb358c",
   "adminKeyScore": 65,
   "multisigScore": 42,
   "timelockScore": 0,
   "oracleAuthorityScore": 100,
   "crossExposureScore": 80,
   "compositeScore": 39,
   "lastUpdated": 1791856659,
   "methodologyHash": "0x0a3df5ccf0492a8006278d8f559a8ee72202d8b3d3b01ff5561fa9729045c276",
   "stale": false,
   "previousComposite": 39,
   "previousRun": "2026-10-14T00:53:13Z"
  },
  {
   "index": 7,
   "target": "0x20c0000000000000000000006fd9a167923ba194",
   "adminKeyScore": 10,
   "multisigScore": 15,
   "timelockScore": 0,
   "oracleAuthorityScore": 100,
   "crossExposureScore": 60,
   "compositeScore": 9,
   "lastUpdated": 1791856659,
   "methodologyHash": "0x0a3df5ccf0492a8006278d8f559a8ee72202d8b3d3b01ff5561fa9729045c276",
   "stale": false,
   "previousComposite": 9,
   "previousRun": "2026-10-14T00:53:13Z"
  },
  {
   "index": 8,
   "target": "0x20c0000000000000000000001621e21f71cf12fb",
   "adminKeyScore": 65,
   "multisigScore": 98,
   "timelockScore": 0,
   "oracleAuthorityScore": 100,
   "crossExposureScore": 80,
   "compositeScore": 55,
   "lastUpdated": 1791856659,
   "methodologyHash": "0x0a3df5ccf0492a8006278d8f559a8ee72202d8b3d3b01ff5561fa9729045c276",
   "stale": false,
   "previousComposite": 55,
   "previousRun": "2026-10-14T00:53:13Z"
  },
  {
   "index": 9,
   "target": "0x20c0000000000000000000000520792dcccccccc",
   "adminKeyScore": 65,
   "multisigScore": 58,
   "timelockScore": 0,
   "oracleAuthorityScore": 100,
   "crossExposureScore": 100,
   "compositeScore": 43,
   "lastUpdated": 1791856659,
   "methodologyHash": "0x0a3df5ccf0492a8006278d8f559a8ee72202d8b3d3b01ff5561fa9729045c276",
   "stale": false,
   "previousComposite": 43,
   "previousRun": "2026-10-14T00:53:13Z"
  },
  {
   "index": 10,
   "target": "0x9a044ae05e5e6290dcf56afd69548565e957a626",
   "adminKeyScore": 10,
   "multisigScore": 15,
   "timelockScore": 60,
   "oracleAuthorityScore": 100,
   "crossExposureScore": 100,
   "compositeScore": 27,
   "lastUpdated": 1791856659,
   "methodologyHash": "0x0a3df5ccf0492a8006278d8f559a8ee72202d8b3d3b01ff5561fa9729045c276",
   "stale": false,
   "previousComposite": 27,
   "previousRun": "2026-10-14T00:53:13Z"
  },
  {
   "index": 11,
   "target": "0x83a1491f3e7f8daab8f787a631334b9ca7a87023",
   "adminKeyScore": 10,
   "multisigScore": 15,
   "timelockScore": 0,
   "oracleAuthorityScore": 100,
   "crossExposureScore": 100,
   "compositeScore": 9,
   "lastUpdated": 1791856659,
   "methodologyHash": "0x0a3df5ccf0492a8006278d8f559a8ee72202d8b3d3b01ff5561fa9729045c276",
   "stale": false,
   "previousComposite": 9,
   "previousRun": "2026-10-14T00:53:13Z"
  },
  {
   "index": 12,
   "target": "0xc609656ed9ef219c98c8e549bf729144f211f06e",
   "adminKeyScore": 65,
   "multisigScore": 56,
   "timelockScore": 60,
   "oracleAuthorityScore": 100,
   "crossExposureScore": 100,
   "compositeScore": 61,
   "lastUpdated": 1791856659,
   "methodologyHash": "0x0a3df5ccf0492a8006278d8f559a8ee72202d8b3d3b01ff5561fa9729045c276",
   "stale": false,
   "previousComposite": 61,
   "previousRun": "2026-10-14T00:53:13Z"
  },
  {
   "index": 13,
   "target": "0x10ee9aac980a180dd4dcfc96c746d60b0ea88f97",
   "adminKeyScore": 65,
   "multisigScore": 96,
   "timelockScore": 0,
   "oracleAuthorityScore": 100,
   "crossExposureScore": 80,
   "compositeScore": 55,
   "lastUpdated": 1791856659,
   "methodologyHash": "0x0a3df5ccf0492a8006278d8f559a8ee72202d8b3d3b01ff5561fa9729045c276",
   "stale": false,
   "previousComposite": 55,
   "previousRun": "2026-10-14T00:53:13Z"
  }
 ],
 "self": {
  "code_hash": "69fdbd05e61b20183d1b21943b6898544e4d23dbf37f687331fdec5c750adfe4",
  "role_events": [],
  "from_block": 39484683,
  "to_block": 39520148,
  "read": true,
  "roles": {
   "0x20630C6Ab4BA48a80edA46F77b9b6e987A8f32f5": {
    "admin": true,
    "updater": true
   },
   "0x646968c33D8F6d5A343B68a6F8b1Ce52F13414ba": {
    "admin": false,
    "updater": false
   }
  },
  "log_span": 5000
 },
 "self_scanned_to": 39520148
}