{
 "name": "Solana (Devnet)",
 "kind": "solana",
 "oracle": "5VhiTAGLEViGgajhxPbzdWz7WLUAiRy42DY6qi6tYh4W",
 "rpc": "https://api.devnet.solana.com",
 "block": null,
 "maxStaleness": 777600,
 "readAt": 1791482464,
 "targets": [
  {
   "index": 0,
   "target": "JUP6LkbZbjS1jKKwapdHNy74zcZ3tLUZoi5QNyVTaV4",
   "adminKeyScore": 55,
   "multisigScore": 83,
   "timelockScore": 0,
   "oracleAuthorityScore": 100,
   "crossExposureScore": 40,
   "compositeScore": 47,
   "lastUpdated": 1790407113,
   "methodologyHash": "0x0f0d0711b206f4b1371e70171771f48867b1fd65da1a81b064fa35d1ca70fce1",
   "stale": true,
   "previousComposite": null,
   "previousRun": null
  },
  {
   "index": 1,
   "target": "7u3HeHxYDLhnCoErrtycNokbQYbWGzLs6JSDqGAv5PfF",
   "adminKeyScore": 65,
   "multisigScore": 76,
   "timelockScore": 25,
   "oracleAuthorityScore": 45,
   "crossExposureScore": 80,
   "compositeScore": 56,
   "lastUpdated": 1790407115,
   "methodologyHash": "0x0f0d0711b206f4b1371e70171771f48867b1fd65da1a81b064fa35d1ca70fce1",
   "stale": true,
   "previousComposite": null,
   "previousRun": null
  },
  {
   "index": 2,
   "target": "7sf3tcWm58vhtkJMwuw2P3T6UBX7UE5VKxPMnXJUZ1Hn",
   "adminKeyScore": 5,
   "multisigScore": 0,
   "timelockScore": 0,
   "oracleAuthorityScore": 100,
   "crossExposureScore": 100,
   "compositeScore": 2,
   "lastUpdated": 1790407116,
   "methodologyHash": "0x0f0d0711b206f4b1371e70171771f48867b1fd65da1a81b064fa35d1ca70fce1",
   "stale": true,
   "previousComposite": null,
   "previousRun": null
  },
  {
   "index": 3,
   "target": "dRiftyHA39MWEi3m9aunc5MzRF1JYuBsbn6VPcn33UH",
   "adminKeyScore": 65,
   "multisigScore": 70,
   "timelockScore": 2,
   "oracleAuthorityScore": 2,
   "crossExposureScore": 100,
   "compositeScore": 48,
   "lastUpdated": 1790407118,
   "methodologyHash": "0x0f0d0711b206f4b1371e70171771f48867b1fd65da1a81b064fa35d1ca70fce1",
   "stale": true,
   "previousComposite": null,
   "previousRun": null
  },
  {
   "index": 4,
   "target": "CAMMCzo5YL8w4VFF8KVHrK22GGUsp5VTaW7grrKgrWqK",
   "adminKeyScore": 20,
   "multisigScore": 20,
   "timelockScore": 0,
   "oracleAuthorityScore": 100,
   "crossExposureScore": 100,
   "compositeScore": 14,
   "lastUpdated": 1790407119,
   "methodologyHash": "0x0f0d0711b206f4b1371e70171771f48867b1fd65da1a81b064fa35d1ca70fce1",
   "stale": true,
   "previousComposite": null,
   "previousRun": null
  },
  {
   "index": 5,
   "target": "4qp6Fx6tnZkY5Wropq9wUYgtFxXKwE6viZxFHg3rdAG8",
   "adminKeyScore": 45,
   "multisigScore": 50,
   "timelockScore": 0,
   "oracleAuthorityScore": 100,
   "crossExposureScore": 100,
   "compositeScore": 33,
   "lastUpdated": 1790407121,
   "methodologyHash": "0x0f0d0711b206f4b1371e70171771f48867b1fd65da1a81b064fa35d1ca70fce1",
   "stale": true,
   "previousComposite": null,
   "previousRun": null
  },
  {
   "index": 6,
   "target": "GKnHiWh3RRrE1zsNzWxRkomymHc374TvJPSTv2wPeYdB",
   "adminKeyScore": 60,
   "multisigScore": 100,
   "timelockScore": 0,
   "oracleAuthorityScore": 100,
   "crossExposureScore": 80,
   "compositeScore": 54,
   "lastUpdated": 1790407127,
   "methodologyHash": "0x0f0d0711b206f4b1371e70171771f48867b1fd65da1a81b064fa35d1ca70fce1",
   "stale": true,
   "previousComposite": null,
   "previousRun": null
  },
  {
   "index": 7,
   "target": "H4ND9aYttUVLFmNypZqLjZ52FYiGvdEB45GmwNoKEjTj",
   "adminKeyScore": 55,
   "multisigScore": 80,
   "timelockScore": 0,
   "oracleAuthorityScore": 100,
   "crossExposureScore": 40,
   "compositeScore": 46,
   "lastUpdated": 1790407128,
   "methodologyHash": "0x0f0d0711b206f4b1371e70171771f48867b1fd65da1a81b064fa35d1ca70fce1",
   "stale": true,
   "previousComposite": null,
   "previousRun": null
  },
  {
   "index": 8,
   "target": "7s1da8DduuBFqGra5bJBjpnvL5E9mGzCuMk1Qkh4or2Z",
   "adminKeyScore": 65,
   "multisigScore": 83,
   "timelockScore": 13,
   "oracleAuthorityScore": 100,
   "crossExposureScore": 60,
   "compositeScore": 55,
   "lastUpdated": 1790407130,
   "methodologyHash": "0x0f0d0711b206f4b1371e70171771f48867b1fd65da1a81b064fa35d1ca70fce1",
   "stale": true,
   "previousComposite": null,
   "previousRun": null
  },
  {
   "index": 9,
   "target": "ADyA8hdefvWN2dbGGWFotbzWxrAvLW83WG6QCVXvJKqw",
   "adminKeyScore": 50,
   "multisigScore": 75,
   "timelockScore": 0,
   "oracleAuthorityScore": 100,
   "crossExposureScore": 100,
   "compositeScore": 43,
   "lastUpdated": 1790407131,
   "methodologyHash": "0x0f0d0711b206f4b1371e70171771f48867b1fd65da1a81b064fa35d1ca70fce1",
   "stale": true,
   "previousComposite": null,
   "previousRun": null
  },
  {
   "index": 10,
   "target": "cpamdpZCGKUy5JxQXB4dcpGPiikHawvSWAd6mEn1sGG",
   "adminKeyScore": 5,
   "multisigScore": 0,
   "timelockScore": 0,
   "oracleAuthorityScore": 100,
   "crossExposureScore": 60,
   "compositeScore": 2,
   "lastUpdated": 1790407133,
   "methodologyHash": "0x0f0d0711b206f4b1371e70171771f48867b1fd65da1a81b064fa35d1ca70fce1",
   "stale": true,
   "previousComposite": null,
   "previousRun": null
  },
  {
   "index": 11,
   "target": "2LecshUwdy9xi7meFgHtFJQNSKk4KdTrcpvaB56dP2NQ",
   "adminKeyScore": 5,
   "multisigScore": 0,
   "timelockScore": 0,
   "oracleAuthorityScore": 100,
   "crossExposureScore": 100,
   "compositeScore": 2,
   "lastUpdated": 1790407136,
   "methodologyHash": "0x0f0d0711b206f4b1371e70171771f48867b1fd65da1a81b064fa35d1ca70fce1",
   "stale": true,
   "previousComposite": null,
   "previousRun": null
  },
  {
   "index": 12,
   "target": "8szGkuLTAux9XMgZ2vtY39jVSowEcpBfFfD8hXSEqdGC",
   "adminKeyScore": 60,
   "multisigScore": 69,
   "timelockScore": 0,
   "oracleAuthorityScore": 100,
   "crossExposureScore": 20,
   "compositeScore": 45,
   "lastUpdated": 1790407137,
   "methodologyHash": "0x0f0d0711b206f4b1371e70171771f48867b1fd65da1a81b064fa35d1ca70fce1",
   "stale": true,
   "previousComposite": null,
   "previousRun": null
  },
  {
   "index": 13,
   "target": "So1endDq2YkqhipRh3WViPa8hdiSpxWy6z3Z6tMCpAo",
   "adminKeyScore": 5,
   "multisigScore": 0,
   "timelockScore": 0,
   "oracleAuthorityScore": 100,
   "crossExposureScore": 100,
   "compositeScore": 2,
   "lastUpdated": 1790407138,
   "methodologyHash": "0x0f0d0711b206f4b1371e70171771f48867b1fd65da1a81b064fa35d1ca70fce1",
   "stale": true,
   "previousComposite": null,
   "previousRun": null
  },
  {
   "index": 14,
   "target": "SPoo1Ku8WFXoNDMHPsrGSTSG1Y47rzgn41SLUNakuHy",
   "adminKeyScore": 60,
   "multisigScore": 100,
   "timelockScore": 0,
   "oracleAuthorityScore": 100,
   "crossExposureScore": 20,
   "compositeScore": 54,
   "lastUpdated": 1790407140,
   "methodologyHash": "0x0f0d0711b206f4b1371e70171771f48867b1fd65da1a81b064fa35d1ca70fce1",
   "stale": true,
   "previousComposite": null,
   "previousRun": null
  },
  {
   "index": 15,
   "target": "Jito4APyf642JPZPx3hGc6WWJ8zPKtRbRs4P815Awbb",
   "adminKeyScore": 60,
   "multisigScore": 100,
   "timelockScore": 0,
   "oracleAuthorityScore": 100,
   "crossExposureScore": 20,
   "compositeScore": 54,
   "lastUpdated": 1790407143,
   "methodologyHash": "0x0f0d0711b206f4b1371e70171771f48867b1fd65da1a81b064fa35d1ca70fce1",
   "stale": true,
   "previousComposite": null,
   "previousRun": null
  },
  {
   "index": 16,
   "target": "5ocnV1qiCgaQR8Jb8xWnVbApfaygJ8tNoZfgPwsgx9kx",
   "adminKeyScore": 55,
   "multisigScore": 80,
   "timelockScore": 0,
   "oracleAuthorityScore": 100,
   "crossExposureScore": 20,
   "compositeScore": 46,
   "lastUpdated": 1790407147,
   "methodologyHash": "0x0f0d0711b206f4b1371e70171771f48867b1fd65da1a81b064fa35d1ca70fce1",
   "stale": true,
   "previousComposite": null,
   "previousRun": null
  },
  {
   "index": 17,
   "target": "SP12tWFxD9oJsVWNavTTBZvMbA6gkAmxtVgxdqvyvhY",
   "adminKeyScore": 60,
   "multisigScore": 100,
   "timelockScore": 0,
   "oracleAuthorityScore": 100,
   "crossExposureScore": 20,
   "compositeScore": 54,
   "lastUpdated": 1790407149,
   "methodologyHash": "0x0f0d0711b206f4b1371e70171771f48867b1fd65da1a81b064fa35d1ca70fce1",
   "stale": true,
   "previousComposite": null,
   "previousRun": null
  }
 ]
}