{
 "name": "Monad",
 "kind": "evm",
 "oracle": "0x50840a7667baEa9D05ad4ae3dCeb384724b58720",
 "rpc": "https://testnet-rpc.monad.xyz/",
 "block": 73391672,
 "maxStaleness": 777600,
 "readAt": 1792717060,
 "targets": [
  {
   "index": 0,
   "target": "0xd691b0afed67f96cec28ab6308cbe5b2c103b7e9",
   "adminKeyScore": 55,
   "multisigScore": 50,
   "timelockScore": 0,
   "oracleAuthorityScore": 100,
   "crossExposureScore": 100,
   "compositeScore": 37,
   "lastUpdated": 1792446167,
   "methodologyHash": "0xf4a5c40caa27b1952c9235737d4bcc6b134faaea8d54c2db3a963aacf896a904",
   "stale": false,
   "previousComposite": 37,
   "previousRun": "2026-10-22T18:48:33Z"
  },
  {
   "index": 1,
   "target": "0x188d586ddcf52439676ca21a244753fa19f9ea8e",
   "adminKeyScore": 80,
   "multisigScore": 100,
   "timelockScore": 60,
   "oracleAuthorityScore": 100,
   "crossExposureScore": 80,
   "compositeScore": 80,
   "lastUpdated": 1792446167,
   "methodologyHash": "0xf4a5c40caa27b1952c9235737d4bcc6b134faaea8d54c2db3a963aacf896a904",
   "stale": false,
   "previousComposite": 80,
   "previousRun": "2026-10-22T18:48:33Z"
  },
  {
   "index": 2,
   "target": "0x36878c6fca7e0e8a88f90dc410cfbbca5b695c95",
   "adminKeyScore": 75,
   "multisigScore": 100,
   "timelockScore": 0,
   "oracleAuthorityScore": 100,
   "crossExposureScore": 100,
   "compositeScore": 60,
   "lastUpdated": 1792446167,
   "methodologyHash": "0xf4a5c40caa27b1952c9235737d4bcc6b134faaea8d54c2db3a963aacf896a904",
   "stale": false,
   "previousComposite": 60,
   "previousRun": "2026-10-22T18:48:33Z"
  },
  {
   "index": 3,
   "target": "0xd651346d7c789536ebf06dc72ae3c8502cd695cc",
   "adminKeyScore": 65,
   "multisigScore": 55,
   "timelockScore": 0,
   "oracleAuthorityScore": 100,
   "crossExposureScore": 100,
   "compositeScore": 43,
   "lastUpdated": 1792446167,
   "methodologyHash": "0xf4a5c40caa27b1952c9235737d4bcc6b134faaea8d54c2db3a963aacf896a904",
   "stale": false,
   "previousComposite": 43,
   "previousRun": "2026-10-22T18:48:33Z"
  },
  {
   "index": 4,
   "target": "0x32841a8511d5c2c5b253f45668780b99139e476d",
   "adminKeyScore": 70,
   "multisigScore": 75,
   "timelockScore": 55,
   "oracleAuthorityScore": 20,
   "crossExposureScore": 80,
   "compositeScore": 67,
   "lastUpdated": 1792446167,
   "methodologyHash": "0xf4a5c40caa27b1952c9235737d4bcc6b134faaea8d54c2db3a963aacf896a904",
   "stale": false,
   "previousComposite": 67,
   "previousRun": "2026-10-22T18:48:33Z"
  },
  {
   "index": 5,
   "target": "0x8271e06e5887fe5ba05234f5315c19f3ec90e8ad",
   "adminKeyScore": 10,
   "multisigScore": 0,
   "timelockScore": 0,
   "oracleAuthorityScore": 100,
   "crossExposureScore": 80,
   "compositeScore": 4,
   "lastUpdated": 1792446167,
   "methodologyHash": "0xf4a5c40caa27b1952c9235737d4bcc6b134faaea8d54c2db3a963aacf896a904",
   "stale": false,
   "previousComposite": 4,
   "previousRun": "2026-10-22T18:48:33Z"
  },
  {
   "index": 6,
   "target": "0xad663ac84052b52be4ed1b27ba416505e84a00bf",
   "adminKeyScore": 60,
   "multisigScore": 65,
   "timelockScore": 0,
   "oracleAuthorityScore": 100,
   "crossExposureScore": 100,
   "compositeScore": 44,
   "lastUpdated": 1792446167,
   "methodologyHash": "0xf4a5c40caa27b1952c9235737d4bcc6b134faaea8d54c2db3a963aacf896a904",
   "stale": false,
   "previousComposite": 44,
   "previousRun": "2026-10-22T18:48:33Z"
  },
  {
   "index": 7,
   "target": "0x34793fb9935f7bb5e5ae920fb963f39063e7a615",
   "adminKeyScore": 65,
   "multisigScore": 75,
   "timelockScore": 0,
   "oracleAuthorityScore": 52,
   "crossExposureScore": 80,
   "compositeScore": 49,
   "lastUpdated": 1792446167,
   "methodologyHash": "0xf4a5c40caa27b1952c9235737d4bcc6b134faaea8d54c2db3a963aacf896a904",
   "stale": false,
   "previousComposite": 49,
   "previousRun": "2026-10-22T18:48:33Z"
  },
  {
   "index": 8,
   "target": "0xba4dd672062de8feedb665dd4410658864483f1e",
   "adminKeyScore": 55,
   "multisigScore": 80,
   "timelockScore": 60,
   "oracleAuthorityScore": 2,
   "crossExposureScore": 80,
   "compositeScore": 64,
   "lastUpdated": 1792446167,
   "methodologyHash": "0xf4a5c40caa27b1952c9235737d4bcc6b134faaea8d54c2db3a963aacf896a904",
   "stale": false,
   "previousComposite": 64,
   "previousRun": "2026-10-22T18:48:33Z"
  }
 ],
 "self": {
  "code_hash": "f33b2e74ee50352539db6b0cc362185c66f79b6b3930811842912995b1b53def",
  "role_events": [],
  "from_block": 73318698,
  "to_block": 73391672,
  "read": false,
  "roles": {
   "0x20630C6Ab4BA48a80edA46F77b9b6e987A8f32f5": {
    "admin": true,
    "updater": true
   },
   "0x646968c33D8F6d5A343B68a6F8b1Ce52F13414ba": {
    "admin": false,
    "updater": false
   }
  },
  "error": "getLogs: window of 72974 blocks needs more than 120 calls at 100 blocks each",
  "gap_blocks": 72974
 },
 "self_scanned_to": 73391672
}