{
 "name": "Hyperliquid (HyperEVM)",
 "kind": "evm",
 "oracle": "0x50840a7667baEa9D05ad4ae3dCeb384724b58720",
 "rpc": "https://rpc.hyperliquid-testnet.xyz/evm",
 "block": 66375497,
 "maxStaleness": 777600,
 "readAt": 1791482463,
 "targets": [
  {
   "index": 0,
   "target": "0xea394cd63ca3a5c8a130bb2b955cc71c22e5ea6c",
   "adminKeyScore": 15,
   "multisigScore": 65,
   "timelockScore": 0,
   "oracleAuthorityScore": 40,
   "crossExposureScore": 100,
   "compositeScore": 26,
   "lastUpdated": 1790279036,
   "methodologyHash": "0xfbf38ff91abf710728e2df3d5370bf18eeb2a9085168612fa03955b13cc958ad",
   "stale": true,
   "previousComposite": 26,
   "previousRun": "2026-10-08T12:37:40Z"
  },
  {
   "index": 1,
   "target": "0x88806a71d74ad0a510b350545c9ae490912f0888",
   "adminKeyScore": 10,
   "multisigScore": 15,
   "timelockScore": 0,
   "oracleAuthorityScore": 4,
   "crossExposureScore": 100,
   "compositeScore": 9,
   "lastUpdated": 1790279036,
   "methodologyHash": "0xfbf38ff91abf710728e2df3d5370bf18eeb2a9085168612fa03955b13cc958ad",
   "stale": true,
   "previousComposite": 9,
   "previousRun": "2026-10-08T12:37:40Z"
  },
  {
   "index": 2,
   "target": "0x320c8988e3d1b5198f335802d7bfd2728a8fcac6",
   "adminKeyScore": 50,
   "multisigScore": 39,
   "timelockScore": 0,
   "oracleAuthorityScore": 58,
   "crossExposureScore": 60,
   "compositeScore": 32,
   "lastUpdated": 1790279036,
   "methodologyHash": "0xfbf38ff91abf710728e2df3d5370bf18eeb2a9085168612fa03955b13cc958ad",
   "stale": true,
   "previousComposite": 32,
   "previousRun": "2026-10-08T12:37:40Z"
  },
  {
   "index": 3,
   "target": "0x30e96fbd515243d47703e78581b88cba60f51360",
   "adminKeyScore": 5,
   "multisigScore": 10,
   "timelockScore": 0,
   "oracleAuthorityScore": 10,
   "crossExposureScore": 100,
   "compositeScore": 5,
   "lastUpdated": 1790279036,
   "methodologyHash": "0xfbf38ff91abf710728e2df3d5370bf18eeb2a9085168612fa03955b13cc958ad",
   "stale": true,
   "previousComposite": 5,
   "previousRun": "2026-10-08T12:37:40Z"
  },
  {
   "index": 4,
   "target": "0xbf6d3bbce71dbce6f4121bfe2e2cad8c77bbc1fc",
   "adminKeyScore": 10,
   "multisigScore": 15,
   "timelockScore": 0,
   "oracleAuthorityScore": 15,
   "crossExposureScore": 80,
   "compositeScore": 9,
   "lastUpdated": 1790279036,
   "methodologyHash": "0xfbf38ff91abf710728e2df3d5370bf18eeb2a9085168612fa03955b13cc958ad",
   "stale": true,
   "previousComposite": 9,
   "previousRun": "2026-10-08T12:37:40Z"
  },
  {
   "index": 5,
   "target": "0x71f0019cc7fa79e4f42587fb7b9a817d8d2429ec",
   "adminKeyScore": 10,
   "multisigScore": 0,
   "timelockScore": 0,
   "oracleAuthorityScore": 7,
   "crossExposureScore": 80,
   "compositeScore": 4,
   "lastUpdated": 1790279036,
   "methodologyHash": "0xfbf38ff91abf710728e2df3d5370bf18eeb2a9085168612fa03955b13cc958ad",
   "stale": true,
   "previousComposite": 4,
   "previousRun": "2026-10-08T12:37:40Z"
  },
  {
   "index": 6,
   "target": "0x8888888c43cbb7e1c4132542e46831bffd866ed3",
   "adminKeyScore": 10,
   "multisigScore": 0,
   "timelockScore": 0,
   "oracleAuthorityScore": 100,
   "crossExposureScore": 100,
   "compositeScore": 4,
   "lastUpdated": 1790279036,
   "methodologyHash": "0xfbf38ff91abf710728e2df3d5370bf18eeb2a9085168612fa03955b13cc958ad",
   "stale": true,
   "previousComposite": 4,
   "previousRun": "2026-10-08T12:37:40Z"
  },
  {
   "index": 7,
   "target": "0x8888888192a4a0593c13532ba48449fc24c3beda",
   "adminKeyScore": 50,
   "multisigScore": 35,
   "timelockScore": 0,
   "oracleAuthorityScore": 100,
   "crossExposureScore": 100,
   "compositeScore": 31,
   "lastUpdated": 1790279036,
   "methodologyHash": "0xfbf38ff91abf710728e2df3d5370bf18eeb2a9085168612fa03955b13cc958ad",
   "stale": true,
   "previousComposite": 31,
   "previousRun": "2026-10-08T12:37:40Z"
  },
  {
   "index": 8,
   "target": "0x393d0b87ed38fc779fd9611144ae649ba6082109",
   "adminKeyScore": 10,
   "multisigScore": 0,
   "timelockScore": 0,
   "oracleAuthorityScore": 15,
   "crossExposureScore": 80,
   "compositeScore": 4,
   "lastUpdated": 1790279036,
   "methodologyHash": "0xfbf38ff91abf710728e2df3d5370bf18eeb2a9085168612fa03955b13cc958ad",
   "stale": true,
   "previousComposite": 4,
   "previousRun": "2026-10-08T12:37:40Z"
  },
  {
   "index": 9,
   "target": "0xdfc24b077bc1425ad1dea75bcb6f8158e10df303",
   "adminKeyScore": 10,
   "multisigScore": 15,
   "timelockScore": 0,
   "oracleAuthorityScore": 100,
   "crossExposureScore": 100,
   "compositeScore": 9,
   "lastUpdated": 1790279036,
   "methodologyHash": "0xfbf38ff91abf710728e2df3d5370bf18eeb2a9085168612fa03955b13cc958ad",
   "stale": true,
   "previousComposite": 9,
   "previousRun": "2026-10-08T12:37:40Z"
  },
  {
   "index": 10,
   "target": "0x574bafce69d9411f662a433896e74e4f153096fa",
   "adminKeyScore": 10,
   "multisigScore": 15,
   "timelockScore": 0,
   "oracleAuthorityScore": 100,
   "crossExposureScore": 100,
   "compositeScore": 9,
   "lastUpdated": 1790279036,
   "methodologyHash": "0xfbf38ff91abf710728e2df3d5370bf18eeb2a9085168612fa03955b13cc958ad",
   "stale": true,
   "previousComposite": 9,
   "previousRun": "2026-10-08T12:37:40Z"
  },
  {
   "index": 11,
   "target": "0x8dafbe89302656a7df43c470e9ebcb4c540835c0",
   "adminKeyScore": 10,
   "multisigScore": 15,
   "timelockScore": 0,
   "oracleAuthorityScore": 100,
   "crossExposureScore": 100,
   "compositeScore": 9,
   "lastUpdated": 1790279036,
   "methodologyHash": "0xfbf38ff91abf710728e2df3d5370bf18eeb2a9085168612fa03955b13cc958ad",
   "stale": true,
   "previousComposite": 9,
   "previousRun": "2026-10-08T12:37:40Z"
  },
  {
   "index": 12,
   "target": "0xa822a9ceb6d6cb5b565bd10098abcfa9cf18d748",
   "adminKeyScore": 10,
   "multisigScore": 15,
   "timelockScore": 0,
   "oracleAuthorityScore": 100,
   "crossExposureScore": 100,
   "compositeScore": 9,
   "lastUpdated": 1790279036,
   "methodologyHash": "0xfbf38ff91abf710728e2df3d5370bf18eeb2a9085168612fa03955b13cc958ad",
   "stale": true,
   "previousComposite": 9,
   "previousRun": "2026-10-08T12:37:40Z"
  },
  {
   "index": 13,
   "target": "0x2df1c51e09aecf9cacb7bc98cb1742757f163df7",
   "adminKeyScore": 65,
   "multisigScore": 59,
   "timelockScore": 15,
   "oracleAuthorityScore": 100,
   "crossExposureScore": 100,
   "compositeScore": 48,
   "lastUpdated": 1790279036,
   "methodologyHash": "0xfbf38ff91abf710728e2df3d5370bf18eeb2a9085168612fa03955b13cc958ad",
   "stale": true,
   "previousComposite": 48,
   "previousRun": "2026-10-08T12:37:40Z"
  },
  {
   "index": 14,
   "target": "0x72c98246a98bfe64022a3190e7710e157497170c",
   "adminKeyScore": 65,
   "multisigScore": 80,
   "timelockScore": 35,
   "oracleAuthorityScore": 100,
   "crossExposureScore": 100,
   "compositeScore": 61,
   "lastUpdated": 1790279036,
   "methodologyHash": "0xfbf38ff91abf710728e2df3d5370bf18eeb2a9085168612fa03955b13cc958ad",
   "stale": true,
   "previousComposite": 61,
   "previousRun": "2026-10-08T12:37:40Z"
  }
 ]
}