{
 "name": "Monad",
 "kind": "evm",
 "oracle": "0x50840a7667baEa9D05ad4ae3dCeb384724b58720",
 "rpc": "https://testnet-rpc.monad.xyz/",
 "block": 69320941,
 "maxStaleness": 777600,
 "readAt": 1791482462,
 "targets": [
  {
   "index": 0,
   "target": "0xd691b0afed67f96cec28ab6308cbe5b2c103b7e9",
   "adminKeyScore": 55,
   "multisigScore": 50,
   "timelockScore": 0,
   "oracleAuthorityScore": 100,
   "crossExposureScore": 100,
   "compositeScore": 37,
   "lastUpdated": 1790270419,
   "methodologyHash": "0x8e05d88ce076e117dd169362399b9f417b8e7f33cc6c73d844139b9b1a7604c7",
   "stale": true,
   "previousComposite": 37,
   "previousRun": "2026-10-08T12:37:40Z"
  },
  {
   "index": 1,
   "target": "0x188d586ddcf52439676ca21a244753fa19f9ea8e",
   "adminKeyScore": 80,
   "multisigScore": 100,
   "timelockScore": 60,
   "oracleAuthorityScore": 100,
   "crossExposureScore": 80,
   "compositeScore": 80,
   "lastUpdated": 1790270419,
   "methodologyHash": "0x8e05d88ce076e117dd169362399b9f417b8e7f33cc6c73d844139b9b1a7604c7",
   "stale": true,
   "previousComposite": 80,
   "previousRun": "2026-10-08T12:37:40Z"
  },
  {
   "index": 2,
   "target": "0x36878c6fca7e0e8a88f90dc410cfbbca5b695c95",
   "adminKeyScore": 75,
   "multisigScore": 100,
   "timelockScore": 0,
   "oracleAuthorityScore": 100,
   "crossExposureScore": 100,
   "compositeScore": 60,
   "lastUpdated": 1790270419,
   "methodologyHash": "0x8e05d88ce076e117dd169362399b9f417b8e7f33cc6c73d844139b9b1a7604c7",
   "stale": true,
   "previousComposite": 60,
   "previousRun": "2026-10-08T12:37:40Z"
  },
  {
   "index": 3,
   "target": "0xd651346d7c789536ebf06dc72ae3c8502cd695cc",
   "adminKeyScore": 65,
   "multisigScore": 55,
   "timelockScore": 0,
   "oracleAuthorityScore": 100,
   "crossExposureScore": 100,
   "compositeScore": 43,
   "lastUpdated": 1790270419,
   "methodologyHash": "0x8e05d88ce076e117dd169362399b9f417b8e7f33cc6c73d844139b9b1a7604c7",
   "stale": true,
   "previousComposite": 43,
   "previousRun": "2026-10-08T12:37:40Z"
  },
  {
   "index": 4,
   "target": "0x32841a8511d5c2c5b253f45668780b99139e476d",
   "adminKeyScore": 70,
   "multisigScore": 55,
   "timelockScore": 55,
   "oracleAuthorityScore": 100,
   "crossExposureScore": 80,
   "compositeScore": 61,
   "lastUpdated": 1790270419,
   "methodologyHash": "0x8e05d88ce076e117dd169362399b9f417b8e7f33cc6c73d844139b9b1a7604c7",
   "stale": true,
   "previousComposite": 61,
   "previousRun": "2026-10-08T12:37:40Z"
  },
  {
   "index": 5,
   "target": "0x8271e06e5887fe5ba05234f5315c19f3ec90e8ad",
   "adminKeyScore": 10,
   "multisigScore": 0,
   "timelockScore": 0,
   "oracleAuthorityScore": 100,
   "crossExposureScore": 80,
   "compositeScore": 4,
   "lastUpdated": 1790270419,
   "methodologyHash": "0x8e05d88ce076e117dd169362399b9f417b8e7f33cc6c73d844139b9b1a7604c7",
   "stale": true,
   "previousComposite": 4,
   "previousRun": "2026-10-08T12:37:40Z"
  },
  {
   "index": 6,
   "target": "0xad663ac84052b52be4ed1b27ba416505e84a00bf",
   "adminKeyScore": 60,
   "multisigScore": 65,
   "timelockScore": 0,
   "oracleAuthorityScore": 100,
   "crossExposureScore": 100,
   "compositeScore": 44,
   "lastUpdated": 1790270419,
   "methodologyHash": "0x8e05d88ce076e117dd169362399b9f417b8e7f33cc6c73d844139b9b1a7604c7",
   "stale": true,
   "previousComposite": 44,
   "previousRun": "2026-10-08T12:37:40Z"
  },
  {
   "index": 7,
   "target": "0x34793fb9935f7bb5e5ae920fb963f39063e7a615",
   "adminKeyScore": 65,
   "multisigScore": 75,
   "timelockScore": 0,
   "oracleAuthorityScore": 100,
   "crossExposureScore": 80,
   "compositeScore": 49,
   "lastUpdated": 1790270419,
   "methodologyHash": "0x8e05d88ce076e117dd169362399b9f417b8e7f33cc6c73d844139b9b1a7604c7",
   "stale": true,
   "previousComposite": 49,
   "previousRun": "2026-10-08T12:37:40Z"
  },
  {
   "index": 8,
   "target": "0xba4dd672062de8feedb665dd4410658864483f1e",
   "adminKeyScore": 55,
   "multisigScore": 80,
   "timelockScore": 60,
   "oracleAuthorityScore": 100,
   "crossExposureScore": 80,
   "compositeScore": 64,
   "lastUpdated": 1790270419,
   "methodologyHash": "0x8e05d88ce076e117dd169362399b9f417b8e7f33cc6c73d844139b9b1a7604c7",
   "stale": true,
   "previousComposite": 64,
   "previousRun": "2026-10-08T12:37:40Z"
  }
 ]
}